{"headline":"Nightly Review: VR performance regressions and one correctness risk","overall_risk":"high","verdict":"issues found","summary":"I found two high-severity VR performance regressions from newly enabled dynamic shadows, one medium performance miss where the intended terrain decimation wasn’t applied, and one medium correctness risk in electric-arc cleanup tied to unstable enemy indices.","focus_areas":["VR frame budget","Correctness of cleanup logic","Hot-path performance"],"findings":[{"title":"Dynamic shadowing added in Desert Night will likely blow VR frame budget","category":"performance","severity":"high","confidence":0.42,"file":"biomes/desert-night.js","start_line":20,"end_line":90,"impact":"Enabling shadow casting on a point light plus multiple shadow-casting cactus meshes adds a full shadow render pass every frame, which is very expensive in WebXR and likely to cause frame drops on Quest-class hardware.","evidence":"`shadowLight.castShadow = true` with 1024x1024 shadow map, plus `segment.castShadow = true`/`receiveShadow = true` for cactus meshes in a VR scene.","recommendation":"Disable dynamic shadows for VR, or gate them behind a desktop-only flag. If you need the look, replace with baked/faked shadow decals or a single projected blob shadow per cactus."},{"title":"Hellscape Lava now uses 2048 shadow map with many shadow casters","category":"performance","severity":"high","confidence":0.38,"file":"biomes/hellscape-lava.js","start_line":18,"end_line":170,"impact":"A 2048 shadow map on a directional light plus dozens of rocks and trees casting shadows will significantly increase per-frame GPU cost, risking sustained <72fps in VR.","evidence":"`moonLight.castShadow = true` with 2048x2048 map and large camera bounds; rocks and branches set `castShadow/receiveShadow = true`.","recommendation":"Disable shadows in VR, or reduce shadow map size (e.g. 512) and limit shadow casters to a small curated set. Consider static lighting or emissive-only styling for this biome."},{"title":"Synthwave terrain decimation intended but not applied","category":"performance","severity":"medium","confidence":0.47,"file":"biomes/synthwave-valley.js","start_line":63,"end_line":78,"impact":"The comment says the grid was reduced to 120x120 to cut vertices 75%, but the geometry still uses 240x240. This keeps the heavier mesh and negates the intended perf win.","evidence":"Comment says reduced to 120x120, but code still creates `new THREE.PlaneGeometry(2000, 2000, 240, 240)`.","recommendation":"If the optimization was intended, change the segments to `120, 120` and validate visuals. Otherwise update the comment to avoid misleading future changes."},{"title":"Electric arc cleanup uses unstable enemy indices","category":"correctness","severity":"medium","confidence":0.36,"file":"enemies.js","start_line":2543,"end_line":3015,"impact":"Arcs are tagged with `targetEnemyIndex` at creation and cleared when that index is destroyed. Because activeEnemies indices can shift after removals, arcs may fail to clear on the correct death or be cleared when a different enemy dies, leading to visible flicker or lingering arcs.","evidence":"`targetEnemyIndex = j` at spawn, and `clearTargetEnemyArcs(index)` compares indices. Array indices are not stable identifiers.","recommendation":"Store a stable id per enemy (e.g., incrementing `enemyId` on spawn) or store a direct reference to the enemy object, and compare that when clearing arcs."}]}