{"headline":"Nightly review: 1 low-severity issue","overall_risk":"low","verdict":"issues found","summary":"One comment-to-code mismatch in `hud.js` may mislead future HUD layout edits and suggests a position change was intended but not applied.","focus_areas":["correctness","maintainability","performance"],"findings":[{"title":"Score position comment does not match actual HUD position","category":"maintainability","severity":"low","confidence":0.62,"file":"hud.js","start_line":1007,"end_line":1009,"impact":"The comment says the score was moved to x=-1.5, but the actual position is still set to x=-0.5. This is misleading and may hide that a requested overlap fix was not applied, making layout regressions more likely.","evidence":"`updateHUD` comment states “Moved right to x=-1.5” while `scoreSprite.position.set(-0.5, 0.3, 0)` remains unchanged in initialization.","recommendation":"Either update the position to match the intended x=-1.5 change or correct the comment to reflect the actual `scoreSprite.position` value."}]}