{"headline":"Nightly Review: 2 actionable issues in nuke flow","overall_risk":"medium","verdict":"issues found","summary":"Found one high-risk progression bug and one stats correctness bug in the new nuke flow. Both are localized to `main.js` and are straightforward to fix.","focus_areas":["Correctness","Runtime stability","VR gameplay progression"],"findings":[{"title":"Nuke kills can leave the level stuck (no completion check after mass kill)","category":"correctness","severity":"high","confidence":0.48,"file":"main.js","start_line":3325,"end_line":3363,"impact":"If a nuke kills the remaining enemies needed to reach `killTarget`, `completeLevel()` is never called. With no enemies left, the level can stall indefinitely until another kill event occurs (which may never happen).","evidence":"`activateNuke()` increments `game.kills` in a loop but does not run the same kill-target/level-complete checks used in `handleHit()` and other kill handlers.","recommendation":"After the loop, run the same completion path used in other kill handlers: update HUD, compute remaining, show kills-remaining alert if needed, and call `completeLevel()` if `game.kills >= cfg.killTarget`. If you want to keep logic centralized, factor the kill-completion check into a helper and call it from both `handleHit()` and `activateNuke()`."},{"title":"`game.totalKills` is incremented twice per nuked enemy","category":"correctness","severity":"medium","confidence":0.55,"file":"main.js","start_line":3353,"end_line":3359,"impact":"`game.totalKills` and kill streak stats are double-counted for each nuke kill, inflating run stats and any logic that depends on `totalKills` (e.g., vampiric intervals, streaks).","evidence":"In `activateNuke()`, each kill does both `game.totalKills++` and `trackKill(false)`, and `trackKill()` already increments `game.totalKills`.","recommendation":"Remove the explicit `game.totalKills++` in `activateNuke()` and rely on `trackKill(false)` for total kill and streak tracking."}]}