{"headline":"Nightly review: no material issues found","overall_risk":"low","verdict":"no material issues found","summary":"No actionable correctness, stability, or VR performance regressions found in the provided diff and nearby context. I did not run tests (review-only).","focus_areas":["VR/per-frame performance risks","state-machine integrity","instanced mesh pool safety","console-error risks"],"findings":[]}