{"headline":"Nightly review: pause menu per-hand stats don’t refresh","overall_risk":"medium","verdict":"issues found","summary":"One correctness issue found: per-hand stats/enemy kill lines in the pause menu are created once and never updated, so values become stale after the first pause menu build.","focus_areas":["pause menu HUD correctness","runtime UI updates"],"findings":[{"title":"Pause menu per-hand stats/enemy kills never refresh after initial build","category":"correctness","severity":"medium","confidence":0.62,"file":"hud.js","start_line":4381,"end_line":4435,"impact":"Pause menu shows stale KILLS/SHOTS/HITS/ACC and enemy-type kills after the first time it’s created, which misleads players and makes the new per-hand stats unreliable.","evidence":"`updateSectionStats` only removes and rebuilds entries tagged `isUpgradeSprite`. The newly added stat lines (`isStatSprite`) and enemy kill lines are created in `createBlasterSection` and never refreshed or removed, so their values freeze at initial creation time.","recommendation":"Extend `updateSectionStats` to also remove and rebuild stat sprites and enemy-kill entries (or add a dedicated refresh path for those sections). Consider tagging the enemy-kill lines and stat lines with distinct `userData` flags and rebuilding them alongside upgrades."}]}