{"headline":"Nightly Review: No Actionable Issues Found","overall_risk":"none","verdict":"no material issues found","summary":"Reviewed the uncommitted HUD tweaks in `hud.js`. The changes are limited to a comment update and a minor scale adjustment for the nuke counter text; no correctness, stability, or performance regressions introduced.","focus_areas":["HUD updates","VR performance hot paths","State stability"],"findings":[]}